{
  "request_id": "1001",
  "created_at": "2026-09-13 08:00:00",
  "name": "正常采集",
  "actions": [
    {
      "name": "主录像",
      "type": "camera_record",
      "device_id": "cam0",
      "scheduled_at": "2026-09-13 09:00:00",
      "params": {
        "type": "timed",
        "duration_s": 60
      },
      "policy": {
        "max_delay_ms": 5000
      }
    },
    {
      "name": "取回主录像",
      "type": "obtain_action_outputs",
      "scheduled_at": "2026-09-13 09:02:00",
      "params": {
        "source": {
          "action_name": "主录像"
        }
      }
    }
  ],
  "last_report_id": "1"
}
