{
  "request_id": "1006",
  "created_at": "2026-09-15 09:01:00",
  "name": "取消与清理",
  "actions": [
    {
      "name": "取消录像",
      "type": "cancel_task",
      "scheduled_at": "2026-09-15 10:00:10",
      "params": {
        "target": {
          "request_id": "1005"
        }
      }
    },
    {
      "name": "清理原有录像",
      "type": "delete_action_outputs",
      "scheduled_at": "2026-09-15 10:00:15",
      "params": {
        "output_ids": [
          "4"
        ]
      }
    },
    {
      "name": "报告进度",
      "type": "report_status",
      "scheduled_at": "2026-09-15 10:00:10",
      "params": {
        "scope": "since",
        "after_report_id": "1"
      }
    }
  ],
  "last_report_id": "1"
}
