{
  "request_id": "1021",
  "created_at": "2026-09-15 11:00:00",
  "name": "清理录像 B 的相机原片",
  "actions": [
    {
      "name": "清理原片 B",
      "type": "delete_action_outputs",
      "scheduled_at": "2026-09-15 12:00:00",
      "params": {
        "output_ids": [
          "15"
        ]
      }
    }
  ],
  "last_report_id": "5"
}
