{
  "request_id": "1",
  "created_at": "2026-01-01 00:00:00",
  "name": "action6-record",
  "actions": [
    {
      "name": "capture",
      "type": "camera_record",
      "device_id": "action6",
      "scheduled_at": "2026-01-01 00:00:10",
      "params": {
        "type": "action6_record",
        "duration_s": 10,
        "exposure": {
          "mode": "auto",
          "compensation_ev": 0
        },
        "resolution": "4k30",
        "fov": "wide",
        "stabilization": "off"
      },
      "policy": {
        "max_delay_ms": 30000
      }
    }
  ]
}
