{
  "request_id": "1",
  "created_at": "2026-01-01 00:00:00",
  "name": "obtain-preview",
  "actions": [
    {
      "name": "obtain-preview",
      "type": "obtain_action_outputs",
      "scheduled_at": "2026-01-01 00:00:10",
      "params": {
        "source": {
          "action_instance_id": "1"
        },
        "filter": "preview"
      }
    }
  ]
}
