{
  "request_id": "1003",
  "created_at": "2026-09-13 08:00:00",
  "name": "组取回部分失败",
  "actions": [
    {
      "name": "第一段录像",
      "type": "camera_record",
      "device_id": "cam0",
      "scheduled_at": "2026-09-13 09:00:00",
      "params": {
        "type": "timed",
        "duration_s": 60
      },
      "policy": {
        "max_delay_ms": 5000
      },
      "group": "早间采集"
    },
    {
      "name": "第二段录像",
      "type": "camera_record",
      "device_id": "cam0",
      "scheduled_at": "2026-09-13 09:02:00",
      "params": {
        "type": "timed",
        "duration_s": 60
      },
      "policy": {
        "max_delay_ms": 5000
      },
      "group": "早间采集"
    },
    {
      "name": "取回整组",
      "type": "obtain_action_outputs",
      "scheduled_at": "2026-09-13 09:04:00",
      "params": {
        "source": {
          "group": "早间采集"
        }
      }
    }
  ]
}
